{"id":"tk-6744","complete":true,"all_chained":true,"books":{"b-12":[303004]},"chains":[[1133,4042,81,973,101306,2371,101286,12637,13901]],"roots":[1133],"nodes":[{"id":1133,"root":1133,"depth":0,"k":1,"n_desc":1,"cl2":false,"cl3":false,"pcl2":false,"pcl3":false},{"id":4042,"root":1133,"depth":1,"k":1,"n_desc":1,"cl2":false,"cl3":false,"pcl2":false,"pcl3":false},{"id":81,"root":1133,"depth":2,"k":1,"n_desc":1,"cl2":false,"cl3":false,"pcl2":false,"pcl3":false},{"id":973,"root":1133,"depth":3,"k":1,"n_desc":1,"cl2":false,"cl3":false,"pcl2":false,"pcl3":false},{"id":101306,"root":1133,"depth":4,"k":1,"n_desc":1,"cl2":false,"cl3":false,"pcl2":false,"pcl3":false},{"id":2371,"root":1133,"depth":5,"k":1,"n_desc":1,"cl2":false,"cl3":false,"pcl2":false,"pcl3":false},{"id":101286,"root":1133,"depth":6,"k":1,"n_desc":1,"cl2":false,"cl3":false,"pcl2":false,"pcl3":false},{"id":12637,"root":1133,"depth":7,"k":1,"n_desc":1,"cl2":false,"cl3":false,"pcl2":false,"pcl3":false},{"id":13901,"root":1133,"depth":8,"k":0,"n_desc":1,"cl2":false,"cl3":false,"pcl2":false,"pcl3":false}],"cl":{},"edits":{"attributed":0,"ambiguous":0,"partial":0,"cross_root":0,"no_chain":0,"no_common_node":0,"by_node":{},"by_node_external":[]},"terms":{"1133-4042":"عن","4042-81":"عن","81-973":"عن","973-101306":"عن","101306-2371":"عن","2371-101286":"ثنا","101286-12637":"ثنا","12637-13901":"حدثنا"},"shawahid":[903,2289]}