{"id":"tk-48653","complete":true,"all_chained":true,"books":{"b-4":[99747],"b-19":[198135]},"chains":[[1339,3090,6815,5879,5997,10859],[1339,3090,6815,5879,5997,12198]],"roots":[1339],"nodes":[{"id":1339,"root":1339,"depth":0,"k":1,"n_desc":2,"cl2":false,"cl3":false,"pcl2":false,"pcl3":false},{"id":3090,"root":1339,"depth":1,"k":1,"n_desc":2,"cl2":false,"cl3":false,"pcl2":false,"pcl3":false},{"id":6815,"root":1339,"depth":2,"k":1,"n_desc":2,"cl2":false,"cl3":false,"pcl2":false,"pcl3":false},{"id":5879,"root":1339,"depth":3,"k":1,"n_desc":2,"cl2":false,"cl3":false,"pcl2":false,"pcl3":false},{"id":5997,"root":1339,"depth":4,"k":2,"n_desc":2,"cl2":true,"cl3":false,"pcl2":false,"pcl3":false},{"id":10859,"root":1339,"depth":5,"k":0,"n_desc":1,"cl2":false,"cl3":false,"pcl2":false,"pcl3":false},{"id":12198,"root":1339,"depth":5,"k":0,"n_desc":1,"cl2":false,"cl3":false,"pcl2":false,"pcl3":false}],"cl":{"k2":{"id":5997,"lo":246,"hi":250,"method":"known","all_chains":true}},"edits":{"attributed":3,"ambiguous":0,"partial":0,"cross_root":0,"no_chain":0,"no_common_node":0,"by_node":{"12198":[{"seg":1,"type":"sub","status":"attributed"},{"seg":3,"type":"sub","status":"attributed"},{"seg":5,"type":"sub","status":"attributed"}]},"by_node_external":[]},"terms":{"1339-3090":"عن","3090-6815":"عن","6815-5879":"عن","5879-5997":"حدثنا","5997-10859":"حدثنا","5997-12198":"حدثنا"},"shawahid":[1339]}