{"id":"tk-6331","complete":false,"all_chained":false,"books":{"b-8":[171499],"b-12":[308796,308797,308883,308964,308982],"b-13":[335547],"b-17":[122157,123103],"b-19":[200088,200089,200118],"b-24":[52403,52408]},"chains":[[2651,1389,5183,2342,5512,113,12198],[2651,1389,5183,2342,5512,12749,12198],[2651,2604,1778,1152,7202,12368,12198],[2651,1389,7242,12430,15011,11611,13901]],"roots":[2651],"nodes":[{"id":2651,"root":2651,"depth":0,"k":2,"n_desc":4,"cl2":true,"cl3":false,"pcl2":false,"pcl3":false},{"id":1389,"root":2651,"depth":1,"k":2,"n_desc":3,"cl2":false,"cl3":false,"pcl2":true,"pcl3":false},{"id":2604,"root":2651,"depth":1,"k":1,"n_desc":1,"cl2":false,"cl3":false,"pcl2":false,"pcl3":false},{"id":1778,"root":2651,"depth":2,"k":1,"n_desc":1,"cl2":false,"cl3":false,"pcl2":false,"pcl3":false},{"id":5183,"root":2651,"depth":2,"k":1,"n_desc":2,"cl2":false,"cl3":false,"pcl2":false,"pcl3":false},{"id":7242,"root":2651,"depth":2,"k":1,"n_desc":1,"cl2":false,"cl3":false,"pcl2":false,"pcl3":false},{"id":1152,"root":2651,"depth":3,"k":1,"n_desc":1,"cl2":false,"cl3":false,"pcl2":false,"pcl3":false},{"id":2342,"root":2651,"depth":3,"k":1,"n_desc":2,"cl2":false,"cl3":false,"pcl2":false,"pcl3":false},{"id":12430,"root":2651,"depth":3,"k":1,"n_desc":1,"cl2":false,"cl3":false,"pcl2":false,"pcl3":false},{"id":5512,"root":2651,"depth":4,"k":2,"n_desc":2,"cl2":false,"cl3":false,"pcl2":true,"pcl3":false},{"id":7202,"root":2651,"depth":4,"k":1,"n_desc":1,"cl2":false,"cl3":false,"pcl2":false,"pcl3":false},{"id":15011,"root":2651,"depth":4,"k":1,"n_desc":1,"cl2":false,"cl3":false,"pcl2":false,"pcl3":false},{"id":113,"root":2651,"depth":5,"k":1,"n_desc":1,"cl2":false,"cl3":false,"pcl2":false,"pcl3":false},{"id":11611,"root":2651,"depth":5,"k":1,"n_desc":1,"cl2":false,"cl3":false,"pcl2":false,"pcl3":false},{"id":12368,"root":2651,"depth":5,"k":1,"n_desc":1,"cl2":false,"cl3":false,"pcl2":false,"pcl3":false},{"id":12749,"root":2651,"depth":5,"k":1,"n_desc":1,"cl2":false,"cl3":false,"pcl2":false,"pcl3":false},{"id":12198,"root":2651,"depth":6,"k":0,"n_desc":3,"cl2":false,"cl3":false,"pcl2":false,"pcl3":false},{"id":13901,"root":2651,"depth":6,"k":0,"n_desc":1,"cl2":false,"cl3":false,"pcl2":false,"pcl3":false}],"cl":{"k2":{"id":2651,"lo":56,"hi":60,"method":"known","all_chains":true}},"edits":{"attributed":0,"ambiguous":1,"partial":1,"cross_root":0,"no_chain":7,"no_common_node":0,"by_node":{"12198":[{"seg":4,"type":"sub","status":"ambiguous"}]},"by_node_external":[]},"terms":{"2651-1389":"عن","1389-5183":"عن","5183-2342":"عن","2342-5512":"نا","5512-113":"نا","113-12198":"حدثنا","5512-12749":"نا","12749-12198":"حدثناه","2651-2604":"عن","2604-1778":"عن","1778-1152":"حدثني","1152-7202":"نا","7202-12368":"حدثني","12368-12198":"حدثنا","1389-7242":"عن","7242-12430":"عن","12430-15011":"نا","15011-11611":"نا","11611-13901":"حدثنا"},"shawahid":[128]}