{"id":"tk-51075","complete":false,"all_chained":false,"books":{"b-3":[94777],"b-5":[71161],"b-8":[178320],"b-13":[334768,338021],"b-17":[135381],"b-22":[85338]},"chains":[[3026,2919,6200,6272,4900,9712],[3026,2919,6200,1739,5904,2577],[3026,2919,6200,6272,12979,13901],[3026,2919,13901]],"roots":[3026],"nodes":[{"id":3026,"root":3026,"depth":0,"k":1,"n_desc":4,"cl2":false,"cl3":false,"pcl2":false,"pcl3":false},{"id":2919,"root":3026,"depth":1,"k":2,"n_desc":4,"cl2":true,"cl3":false,"pcl2":false,"pcl3":false},{"id":6200,"root":3026,"depth":2,"k":2,"n_desc":3,"cl2":false,"cl3":false,"pcl2":true,"pcl3":false},{"id":13901,"root":3026,"depth":2,"k":0,"n_desc":2,"cl2":false,"cl3":false,"pcl2":false,"pcl3":false},{"id":1739,"root":3026,"depth":3,"k":1,"n_desc":1,"cl2":false,"cl3":false,"pcl2":false,"pcl3":false},{"id":6272,"root":3026,"depth":3,"k":2,"n_desc":2,"cl2":false,"cl3":false,"pcl2":true,"pcl3":false},{"id":4900,"root":3026,"depth":4,"k":1,"n_desc":1,"cl2":false,"cl3":false,"pcl2":false,"pcl3":false},{"id":5904,"root":3026,"depth":4,"k":1,"n_desc":1,"cl2":false,"cl3":false,"pcl2":false,"pcl3":false},{"id":12979,"root":3026,"depth":4,"k":1,"n_desc":1,"cl2":false,"cl3":false,"pcl2":false,"pcl3":false},{"id":2577,"root":3026,"depth":5,"k":0,"n_desc":1,"cl2":false,"cl3":false,"pcl2":false,"pcl3":false},{"id":9712,"root":3026,"depth":5,"k":0,"n_desc":1,"cl2":false,"cl3":false,"pcl2":false,"pcl3":false}],"cl":{"k2":{"id":2919,"lo":67,"hi":154,"method":"inferred","all_chains":true}},"edits":{"attributed":4,"ambiguous":0,"partial":1,"cross_root":0,"no_chain":2,"no_common_node":0,"by_node":{"2577":[{"seg":1,"type":"sub","status":"attributed"}],"12979":[{"seg":8,"type":"sub","status":"attributed"},{"seg":12,"type":"sub","status":"attributed"}],"9712":[{"seg":10,"type":"sub","status":"attributed"}]},"by_node_external":[]},"terms":{"3026-2919":"عن","2919-6200":"حدثتنا","6200-6272":"حدثنا","6272-4900":"حدثنا","4900-9712":"أخبرنا","6200-1739":"نا","1739-5904":"نا","5904-2577":"حدثنا","6272-12979":"نا","12979-13901":"حدثنا","2919-13901":"عن"},"shawahid":[3026]}