{"id":"tk-66028","complete":false,"all_chained":false,"books":{"b-12":[311128,311129],"b-19":[197261],"b-31":[297325]},"chains":[[3913,4956,4851,2638,12593,17435,12198]],"roots":[3913],"nodes":[{"id":3913,"root":3913,"depth":0,"k":1,"n_desc":1,"cl2":false,"cl3":false,"pcl2":false,"pcl3":false},{"id":4956,"root":3913,"depth":1,"k":1,"n_desc":1,"cl2":false,"cl3":false,"pcl2":false,"pcl3":false},{"id":4851,"root":3913,"depth":2,"k":1,"n_desc":1,"cl2":false,"cl3":false,"pcl2":false,"pcl3":false},{"id":2638,"root":3913,"depth":3,"k":1,"n_desc":1,"cl2":false,"cl3":false,"pcl2":false,"pcl3":false},{"id":12593,"root":3913,"depth":4,"k":1,"n_desc":1,"cl2":false,"cl3":false,"pcl2":false,"pcl3":false},{"id":17435,"root":3913,"depth":5,"k":1,"n_desc":1,"cl2":false,"cl3":false,"pcl2":false,"pcl3":false},{"id":12198,"root":3913,"depth":6,"k":0,"n_desc":1,"cl2":false,"cl3":false,"pcl2":false,"pcl3":false}],"cl":{},"edits":{"attributed":0,"ambiguous":0,"partial":0,"cross_root":0,"no_chain":0,"no_common_node":0,"by_node":{},"by_node_external":[]},"terms":{"3913-4956":"عن","4956-4851":"عن","4851-2638":"عن","2638-12593":"نا","12593-17435":"نا","17435-12198":"حدثنا"},"shawahid":[]}