{"id":"tk-15548","complete":false,"all_chained":false,"books":{"b-12":[317554],"b-15":[239834],"b-26":[207112]},"chains":[[3655,4385,5348,6709,3889]],"roots":[3655],"nodes":[{"id":3655,"root":3655,"depth":0,"k":1,"n_desc":1,"cl2":false,"cl3":false,"pcl2":false,"pcl3":false},{"id":4385,"root":3655,"depth":1,"k":1,"n_desc":1,"cl2":false,"cl3":false,"pcl2":false,"pcl3":false},{"id":5348,"root":3655,"depth":2,"k":1,"n_desc":1,"cl2":false,"cl3":false,"pcl2":false,"pcl3":false},{"id":6709,"root":3655,"depth":3,"k":1,"n_desc":1,"cl2":false,"cl3":false,"pcl2":false,"pcl3":false},{"id":3889,"root":3655,"depth":4,"k":0,"n_desc":1,"cl2":false,"cl3":false,"pcl2":false,"pcl3":false}],"cl":{},"edits":{"attributed":0,"ambiguous":0,"partial":0,"cross_root":0,"no_chain":3,"no_common_node":0,"by_node":{},"by_node_external":[]},"terms":{"3655-4385":"رأيت","4385-5348":"عن","5348-6709":"أخبرنا","6709-3889":"حدثنا"},"shawahid":[2,822,895,1091,2642,3026,3320,3655,3807,3913,4307,4493,5324,5367,5371,6760,11234,22587]}