{"id":"tk-8470","complete":false,"all_chained":false,"books":{"b-9":[106633],"b-12":[301160,301161,301177,301262],"b-19":[196371,196379],"b-26":[208470,208472],"b-28":[287408]},"chains":[[1004,2436,6468,6361,1132,7223,12198],[1004,6088,4851,611,4891,3133,12198],[1004,4677,2436,6468,5244,13551,13014,13901],[1004,2436,6468,6361,1132,4316,13375,13901],[1004,3807,8393,5117,6825,1431,11473,13901],[1004,6088,4851,611,4308,7006,11497,13901]],"roots":[1004],"nodes":[{"id":1004,"root":1004,"depth":0,"k":4,"n_desc":6,"cl2":true,"cl3":true,"pcl2":false,"pcl3":false},{"id":2436,"root":1004,"depth":1,"k":1,"n_desc":3,"cl2":false,"cl3":false,"pcl2":false,"pcl3":false},{"id":3807,"root":1004,"depth":1,"k":1,"n_desc":1,"cl2":false,"cl3":false,"pcl2":false,"pcl3":false},{"id":4677,"root":1004,"depth":1,"k":1,"n_desc":1,"cl2":false,"cl3":false,"pcl2":false,"pcl3":false},{"id":6088,"root":1004,"depth":1,"k":1,"n_desc":2,"cl2":false,"cl3":false,"pcl2":false,"pcl3":false},{"id":4851,"root":1004,"depth":2,"k":1,"n_desc":2,"cl2":false,"cl3":false,"pcl2":false,"pcl3":false},{"id":6468,"root":1004,"depth":2,"k":2,"n_desc":3,"cl2":false,"cl3":false,"pcl2":true,"pcl3":false},{"id":8393,"root":1004,"depth":2,"k":1,"n_desc":1,"cl2":false,"cl3":false,"pcl2":false,"pcl3":false},{"id":611,"root":1004,"depth":3,"k":2,"n_desc":2,"cl2":false,"cl3":false,"pcl2":true,"pcl3":false},{"id":5117,"root":1004,"depth":3,"k":1,"n_desc":1,"cl2":false,"cl3":false,"pcl2":false,"pcl3":false},{"id":5244,"root":1004,"depth":3,"k":1,"n_desc":1,"cl2":false,"cl3":false,"pcl2":false,"pcl3":false},{"id":6361,"root":1004,"depth":3,"k":1,"n_desc":2,"cl2":false,"cl3":false,"pcl2":false,"pcl3":false},{"id":1132,"root":1004,"depth":4,"k":2,"n_desc":2,"cl2":false,"cl3":false,"pcl2":true,"pcl3":false},{"id":4308,"root":1004,"depth":4,"k":1,"n_desc":1,"cl2":false,"cl3":false,"pcl2":false,"pcl3":false},{"id":4891,"root":1004,"depth":4,"k":1,"n_desc":1,"cl2":false,"cl3":false,"pcl2":false,"pcl3":false},{"id":6825,"root":1004,"depth":4,"k":1,"n_desc":1,"cl2":false,"cl3":false,"pcl2":false,"pcl3":false},{"id":13551,"root":1004,"depth":4,"k":1,"n_desc":1,"cl2":false,"cl3":false,"pcl2":false,"pcl3":false},{"id":1431,"root":1004,"depth":5,"k":1,"n_desc":1,"cl2":false,"cl3":false,"pcl2":false,"pcl3":false},{"id":3133,"root":1004,"depth":5,"k":1,"n_desc":1,"cl2":false,"cl3":false,"pcl2":false,"pcl3":false},{"id":4316,"root":1004,"depth":5,"k":1,"n_desc":1,"cl2":false,"cl3":false,"pcl2":false,"pcl3":false},{"id":7006,"root":1004,"depth":5,"k":1,"n_desc":1,"cl2":false,"cl3":false,"pcl2":false,"pcl3":false},{"id":7223,"root":1004,"depth":5,"k":1,"n_desc":1,"cl2":false,"cl3":false,"pcl2":false,"pcl3":false},{"id":13014,"root":1004,"depth":5,"k":1,"n_desc":1,"cl2":false,"cl3":false,"pcl2":false,"pcl3":false},{"id":11473,"root":1004,"depth":6,"k":1,"n_desc":1,"cl2":false,"cl3":false,"pcl2":false,"pcl3":false},{"id":11497,"root":1004,"depth":6,"k":1,"n_desc":1,"cl2":false,"cl3":false,"pcl2":false,"pcl3":false},{"id":12198,"root":1004,"depth":6,"k":0,"n_desc":2,"cl2":false,"cl3":false,"pcl2":false,"pcl3":false},{"id":13375,"root":1004,"depth":6,"k":1,"n_desc":1,"cl2":false,"cl3":false,"pcl2":false,"pcl3":false},{"id":13901,"root":1004,"depth":6,"k":0,"n_desc":4,"cl2":false,"cl3":false,"pcl2":false,"pcl3":false}],"cl":{"k2":{"id":1004,"lo":21,"hi":23,"method":"known","all_chains":true},"k3":{"id":1004,"lo":21,"hi":23,"method":"known","all_chains":true}},"edits":{"attributed":0,"ambiguous":15,"partial":3,"cross_root":0,"no_chain":8,"no_common_node":0,"by_node":{"13901":[{"seg":1,"type":"sub","status":"ambiguous"},{"seg":7,"type":"sub","status":"ambiguous"},{"seg":9,"type":"sub","status":"ambiguous"},{"seg":12,"type":"sub","status":"ambiguous"},{"seg":17,"type":"sub","status":"ambiguous"},{"seg":18,"type":"sub","status":"ambiguous"},{"seg":22,"type":"sub","status":"ambiguous"},{"seg":24,"type":"sub","status":"ambiguous"},{"seg":29,"type":"sub","status":"ambiguous"},{"seg":30,"type":"sub","status":"ambiguous"},{"seg":33,"type":"sub","status":"ambiguous"},{"seg":38,"type":"sub","status":"ambiguous"}],"12198":[{"seg":4,"type":"sub","status":"ambiguous"},{"seg":6,"type":"sub","status":"ambiguous"}],"1004":[{"seg":40,"type":"sub","status":"ambiguous"}]},"by_node_external":[]},"terms":{"1004-2436":"عن","2436-6468":"عن","6468-6361":"عن","6361-1132":"عن","1132-7223":"نا","7223-12198":"حدثنا","1004-6088":"عن","6088-4851":"عن","4851-611":"عن","611-4891":"نا","4891-3133":"نا","3133-12198":"حدثنا","1004-4677":"عن","4677-2436":"عن","6468-5244":"عن","5244-13551":"ثنا","13551-13014":"حدثنا","13014-13901":"حدثنا","1132-4316":"حدثنا","4316-13375":"ثنا","13375-13901":"حدثنا","1004-3807":"أن","3807-8393":"قال","8393-5117":"ثنا","5117-6825":"ثنا","6825-1431":"ثنا","1431-11473":"ثنا","11473-13901":"حدثنا","611-4308":"ثنا","4308-7006":"ثنا","7006-11497":"ثنا","11497-13901":"حدثنا"},"shawahid":[1004,2313,2436,5244]}