{"id":"tk-3863","complete":false,"all_chained":false,"books":{"b-4":[96487],"b-5":[64548],"b-8":[157600],"b-15":[240718,240769],"b-17":[120907,120908,120950],"b-18":[146237,146239],"b-19":[203698,204580,205054],"b-22":[74448,74478],"b-24":[51983,51984],"b-28":[282591,282592,282625]},"chains":[[3320,3745,5860,5106,1465,9712],[3320,1906,2638,5879,6740,10859],[3320,3745,5860,5106,7213,13137,13092,11776,15071],[3320,5833,13018,5093,3145,12319,11776,15071],[3320,1906,2638,5879,5898,13155,13378,11749,15071],[3320,5833,13018,5093,3145,12066,12982],[3320,1906,2638,5879,2500,11528,12982],[3320,1906,2638,5879,3889],[3320,8226,9271,6931,3889]],"roots":[3320],"nodes":[{"id":3320,"root":3320,"depth":0,"k":4,"n_desc":9,"cl2":true,"cl3":true,"pcl2":false,"pcl3":false},{"id":1906,"root":3320,"depth":1,"k":1,"n_desc":4,"cl2":false,"cl3":false,"pcl2":false,"pcl3":false},{"id":3745,"root":3320,"depth":1,"k":1,"n_desc":2,"cl2":false,"cl3":false,"pcl2":false,"pcl3":false},{"id":5833,"root":3320,"depth":1,"k":1,"n_desc":2,"cl2":false,"cl3":false,"pcl2":false,"pcl3":false},{"id":8226,"root":3320,"depth":1,"k":1,"n_desc":1,"cl2":false,"cl3":false,"pcl2":false,"pcl3":false},{"id":2638,"root":3320,"depth":2,"k":1,"n_desc":4,"cl2":false,"cl3":false,"pcl2":false,"pcl3":false},{"id":5860,"root":3320,"depth":2,"k":1,"n_desc":2,"cl2":false,"cl3":false,"pcl2":false,"pcl3":false},{"id":9271,"root":3320,"depth":2,"k":1,"n_desc":1,"cl2":false,"cl3":false,"pcl2":false,"pcl3":false},{"id":13018,"root":3320,"depth":2,"k":1,"n_desc":2,"cl2":false,"cl3":false,"pcl2":false,"pcl3":false},{"id":5093,"root":3320,"depth":3,"k":1,"n_desc":2,"cl2":false,"cl3":false,"pcl2":false,"pcl3":false},{"id":5106,"root":3320,"depth":3,"k":2,"n_desc":2,"cl2":false,"cl3":false,"pcl2":true,"pcl3":false},{"id":5879,"root":3320,"depth":3,"k":4,"n_desc":4,"cl2":false,"cl3":false,"pcl2":true,"pcl3":true},{"id":6931,"root":3320,"depth":3,"k":1,"n_desc":1,"cl2":false,"cl3":false,"pcl2":false,"pcl3":false},{"id":1465,"root":3320,"depth":4,"k":1,"n_desc":1,"cl2":false,"cl3":false,"pcl2":false,"pcl3":false},{"id":2500,"root":3320,"depth":4,"k":1,"n_desc":1,"cl2":false,"cl3":false,"pcl2":false,"pcl3":false},{"id":3145,"root":3320,"depth":4,"k":2,"n_desc":2,"cl2":false,"cl3":false,"pcl2":true,"pcl3":false},{"id":3889,"root":3320,"depth":4,"k":0,"n_desc":2,"cl2":false,"cl3":false,"pcl2":false,"pcl3":false},{"id":5898,"root":3320,"depth":4,"k":1,"n_desc":1,"cl2":false,"cl3":false,"pcl2":false,"pcl3":false},{"id":6740,"root":3320,"depth":4,"k":1,"n_desc":1,"cl2":false,"cl3":false,"pcl2":false,"pcl3":false},{"id":7213,"root":3320,"depth":4,"k":1,"n_desc":1,"cl2":false,"cl3":false,"pcl2":false,"pcl3":false},{"id":9712,"root":3320,"depth":5,"k":0,"n_desc":1,"cl2":false,"cl3":false,"pcl2":false,"pcl3":false},{"id":10859,"root":3320,"depth":5,"k":0,"n_desc":1,"cl2":false,"cl3":false,"pcl2":false,"pcl3":false},{"id":11528,"root":3320,"depth":5,"k":1,"n_desc":1,"cl2":false,"cl3":false,"pcl2":false,"pcl3":false},{"id":12066,"root":3320,"depth":5,"k":1,"n_desc":1,"cl2":false,"cl3":false,"pcl2":false,"pcl3":false},{"id":12319,"root":3320,"depth":5,"k":1,"n_desc":1,"cl2":false,"cl3":false,"pcl2":false,"pcl3":false},{"id":13137,"root":3320,"depth":5,"k":1,"n_desc":1,"cl2":false,"cl3":false,"pcl2":false,"pcl3":false},{"id":13155,"root":3320,"depth":5,"k":1,"n_desc":1,"cl2":false,"cl3":false,"pcl2":false,"pcl3":false},{"id":11776,"root":3320,"depth":6,"k":1,"n_desc":2,"cl2":false,"cl3":false,"pcl2":false,"pcl3":false},{"id":12982,"root":3320,"depth":6,"k":0,"n_desc":2,"cl2":false,"cl3":false,"pcl2":false,"pcl3":false},{"id":13092,"root":3320,"depth":6,"k":1,"n_desc":1,"cl2":false,"cl3":false,"pcl2":false,"pcl3":false},{"id":13378,"root":3320,"depth":6,"k":1,"n_desc":1,"cl2":false,"cl3":false,"pcl2":false,"pcl3":false},{"id":11749,"root":3320,"depth":7,"k":1,"n_desc":1,"cl2":false,"cl3":false,"pcl2":false,"pcl3":false},{"id":15071,"root":3320,"depth":7,"k":0,"n_desc":3,"cl2":false,"cl3":false,"pcl2":false,"pcl3":false}],"cl":{"k2":{"id":3320,"lo":57,"hi":59,"method":"known","all_chains":true},"k3":{"id":3320,"lo":57,"hi":59,"method":"known","all_chains":true}},"edits":{"attributed":2,"ambiguous":0,"partial":18,"cross_root":0,"no_chain":13,"no_common_node":0,"by_node":{"9712":[{"seg":22,"type":"sub","status":"attributed"},{"seg":31,"type":"sub","status":"attributed"}]},"by_node_external":[]},"terms":{"3320-3745":"عن","3745-5860":"عن","5860-5106":"عن","5106-1465":"أنبأنا","1465-9712":"أخبرنا","3320-1906":"عن","1906-2638":"عن","2638-5879":"عن","5879-6740":"حدثنا","6740-10859":"حدثنا","5106-7213":"ثنا","7213-13137":"ثنا","13137-13092":"ثنا","13092-11776":"أنبأ","11776-15071":"أخبرنا","3320-5833":"أنه سمع","5833-13018":"عن","13018-5093":"ثنا","5093-3145":"ثنا","3145-12319":"أنا","12319-11776":"ثنا","5879-5898":"ثنا","5898-13155":"ثنا","13155-13378":"ثنا","13378-11749":"أنا","11749-15071":"أخبرنا","3145-12066":"حدثنا","12066-12982":"حدثنا","5879-2500":"حدثنا","2500-11528":"حدثنا","11528-12982":"حدثنا","5879-3889":"حدثنا","3320-8226":"سألت","8226-9271":"عن","9271-6931":"عن","6931-3889":"حدثنا"},"shawahid":[822,903,1091,1389,1731,2640,3320,3535,3732,3807,3823,3856,3913,4385,4435,4677,4813,5410,5826]}