{"id":"tk-1439","complete":false,"all_chained":false,"books":{"b-5":[67423,67424],"b-8":[170380,172121,172122],"b-12":[325022],"b-21":[181513],"b-22":[76224,76225]},"chains":[[1835,6109,704,2725,4869,9712],[1835,6109,704,7130,3395,9712]],"roots":[1835],"nodes":[{"id":1835,"root":1835,"depth":0,"k":1,"n_desc":2,"cl2":false,"cl3":false,"pcl2":false,"pcl3":false},{"id":6109,"root":1835,"depth":1,"k":1,"n_desc":2,"cl2":false,"cl3":false,"pcl2":false,"pcl3":false},{"id":704,"root":1835,"depth":2,"k":2,"n_desc":2,"cl2":true,"cl3":false,"pcl2":false,"pcl3":false},{"id":2725,"root":1835,"depth":3,"k":1,"n_desc":1,"cl2":false,"cl3":false,"pcl2":false,"pcl3":false},{"id":7130,"root":1835,"depth":3,"k":1,"n_desc":1,"cl2":false,"cl3":false,"pcl2":false,"pcl3":false},{"id":3395,"root":1835,"depth":4,"k":1,"n_desc":1,"cl2":false,"cl3":false,"pcl2":false,"pcl3":false},{"id":4869,"root":1835,"depth":4,"k":1,"n_desc":1,"cl2":false,"cl3":false,"pcl2":false,"pcl3":false},{"id":9712,"root":1835,"depth":5,"k":0,"n_desc":2,"cl2":false,"cl3":false,"pcl2":false,"pcl3":false}],"cl":{"k2":{"id":704,"lo":157,"hi":168,"method":"known","all_chains":true}},"edits":{"attributed":0,"ambiguous":2,"partial":4,"cross_root":0,"no_chain":7,"no_common_node":0,"by_node":{"9712":[{"seg":3,"type":"sub","status":"ambiguous"},{"seg":15,"type":"sub","status":"ambiguous"}]},"by_node_external":[]},"terms":{"1835-6109":"عن","6109-704":"عن","704-2725":"حدثنا","2725-4869":"حدثني","4869-9712":"أخبرنا","704-7130":"أنبأنا","7130-3395":"حدثنا","3395-9712":"أخبرنا"},"shawahid":[1181,1565,3026,3320,3807,3823,4500,4839,4966,7271,22587]}