{"id":"tk-43005","complete":false,"all_chained":false,"books":{"b-3":[95786],"b-6":[113218],"b-8":[150530],"b-15":[267393],"b-19":[194949],"b-24":[62252]},"chains":[[4677,6088,3071,5407,3796,6656,3889,2577],[4677,6088,3071,5407,3796,6656,3889,10935],[4677,6088,3071,5407,3796,6656,5095]],"roots":[4677],"nodes":[{"id":4677,"root":4677,"depth":0,"k":1,"n_desc":3,"cl2":false,"cl3":false,"pcl2":false,"pcl3":false},{"id":6088,"root":4677,"depth":1,"k":1,"n_desc":3,"cl2":false,"cl3":false,"pcl2":false,"pcl3":false},{"id":3071,"root":4677,"depth":2,"k":1,"n_desc":3,"cl2":false,"cl3":false,"pcl2":false,"pcl3":false},{"id":5407,"root":4677,"depth":3,"k":1,"n_desc":3,"cl2":false,"cl3":false,"pcl2":false,"pcl3":false},{"id":3796,"root":4677,"depth":4,"k":1,"n_desc":3,"cl2":false,"cl3":false,"pcl2":false,"pcl3":false},{"id":6656,"root":4677,"depth":5,"k":2,"n_desc":3,"cl2":true,"cl3":false,"pcl2":false,"pcl3":false},{"id":3889,"root":4677,"depth":6,"k":2,"n_desc":2,"cl2":false,"cl3":false,"pcl2":true,"pcl3":false},{"id":5095,"root":4677,"depth":6,"k":0,"n_desc":1,"cl2":false,"cl3":false,"pcl2":false,"pcl3":false},{"id":2577,"root":4677,"depth":7,"k":0,"n_desc":1,"cl2":false,"cl3":false,"pcl2":false,"pcl3":false},{"id":10935,"root":4677,"depth":7,"k":0,"n_desc":1,"cl2":false,"cl3":false,"pcl2":false,"pcl3":false}],"cl":{"k2":{"id":6656,"lo":208,"hi":210,"method":"known","all_chains":true}},"edits":{"attributed":0,"ambiguous":0,"partial":0,"cross_root":0,"no_chain":4,"no_common_node":0,"by_node":{},"by_node_external":[]},"terms":{"4677-6088":"لقيت","6088-3071":"عن","3071-5407":"عن","5407-3796":"نا","3796-6656":"نا","6656-3889":"نا","3889-2577":"حدثنا","3889-10935":"حدثنا","6656-5095":"نا"},"shawahid":[4677]}