{"id":"tk-42865","complete":true,"all_chained":false,"books":{"b-15":[237122,248261]},"chains":[[8547,2238,2638,6792,3889]],"roots":[8547],"nodes":[{"id":8547,"root":8547,"depth":0,"k":1,"n_desc":1,"cl2":false,"cl3":false,"pcl2":false,"pcl3":false},{"id":2238,"root":8547,"depth":1,"k":1,"n_desc":1,"cl2":false,"cl3":false,"pcl2":false,"pcl3":false},{"id":2638,"root":8547,"depth":2,"k":1,"n_desc":1,"cl2":false,"cl3":false,"pcl2":false,"pcl3":false},{"id":6792,"root":8547,"depth":3,"k":1,"n_desc":1,"cl2":false,"cl3":false,"pcl2":false,"pcl3":false},{"id":3889,"root":8547,"depth":4,"k":0,"n_desc":1,"cl2":false,"cl3":false,"pcl2":false,"pcl3":false}],"cl":{},"edits":{"attributed":0,"ambiguous":0,"partial":0,"cross_root":0,"no_chain":0,"no_common_node":0,"by_node":{},"by_node_external":[]},"terms":{"8547-2238":"عن","2238-2638":"عن","2638-6792":"حدثنا","6792-3889":"حدثنا"},"shawahid":[]}