{"id":"tk-20346","complete":false,"all_chained":false,"books":{"b-4":[101344,102035],"b-5":[67322],"b-8":[176444,176965,177616],"b-11":[26564],"b-22":[76124,86938,88292],"b-23":[189727,189849],"b-24":[56151],"b-26":[211974]},"chains":[[3026,6058,1619,465,12391],[3026,6058,1619,5954,9712],[3026,6058,1619,2856,10859],[3026,6058,1619,2856,10859]],"roots":[3026],"nodes":[{"id":3026,"root":3026,"depth":0,"k":1,"n_desc":4,"cl2":false,"cl3":false,"pcl2":false,"pcl3":false},{"id":6058,"root":3026,"depth":1,"k":1,"n_desc":4,"cl2":false,"cl3":false,"pcl2":false,"pcl3":false},{"id":1619,"root":3026,"depth":2,"k":3,"n_desc":4,"cl2":true,"cl3":true,"pcl2":false,"pcl3":false},{"id":465,"root":3026,"depth":3,"k":1,"n_desc":1,"cl2":false,"cl3":false,"pcl2":false,"pcl3":false},{"id":2856,"root":3026,"depth":3,"k":1,"n_desc":2,"cl2":false,"cl3":false,"pcl2":false,"pcl3":false},{"id":5954,"root":3026,"depth":3,"k":1,"n_desc":1,"cl2":false,"cl3":false,"pcl2":false,"pcl3":false},{"id":9712,"root":3026,"depth":4,"k":0,"n_desc":1,"cl2":false,"cl3":false,"pcl2":false,"pcl3":false},{"id":10859,"root":3026,"depth":4,"k":0,"n_desc":2,"cl2":false,"cl3":false,"pcl2":false,"pcl3":false},{"id":12391,"root":3026,"depth":4,"k":0,"n_desc":1,"cl2":false,"cl3":false,"pcl2":false,"pcl3":false}],"cl":{"k2":{"id":1619,"lo":175,"hi":179,"method":"known","all_chains":true},"k3":{"id":1619,"lo":175,"hi":179,"method":"known","all_chains":true}},"edits":{"attributed":0,"ambiguous":1,"partial":1,"cross_root":0,"no_chain":2,"no_common_node":0,"by_node":{"10859":[{"seg":6,"type":"sub","status":"ambiguous"}]},"by_node_external":[]},"terms":{"3026-6058":"سمع","6058-1619":"حدثنا","1619-465":"أخبرنا","465-12391":"حدثنا","1619-5954":"حدثنا","5954-9712":"أخبرنا","1619-2856":"حدثنا","2856-10859":"حدثنا"},"shawahid":[3026]}