{"id":"tk-15409","complete":false,"all_chained":false,"books":{"b-2":[13341,13342,13343],"b-8":[165073,165119,165502,165706],"b-10":[34175],"b-11":[25315],"b-13":[335435,335696],"b-15":[243913,243917],"b-17":[124876],"b-21":[182105],"b-23":[187202],"b-29":[193924,194015]},"chains":[[1091,5914,2082,2029,1325,6116],[1091,6347,2339,4076,3460,5898,6116],[1091,6347,5333,6257,3057,6116],[1091,6347,1851,4076,4777,12391],[1091,3778,6436,6792,3889],[1091,5914,5717,4601,3889],[1091,6347,5333,6257,5897,11544,13901],[1091,6347,1851,4076,4777,12535,13901]],"roots":[1091],"nodes":[{"id":1091,"root":1091,"depth":0,"k":3,"n_desc":8,"cl2":true,"cl3":true,"pcl2":false,"pcl3":false},{"id":3778,"root":1091,"depth":1,"k":1,"n_desc":1,"cl2":false,"cl3":false,"pcl2":false,"pcl3":false},{"id":5914,"root":1091,"depth":1,"k":2,"n_desc":2,"cl2":false,"cl3":false,"pcl2":true,"pcl3":false},{"id":6347,"root":1091,"depth":1,"k":3,"n_desc":5,"cl2":false,"cl3":false,"pcl2":true,"pcl3":true},{"id":1851,"root":1091,"depth":2,"k":1,"n_desc":2,"cl2":false,"cl3":false,"pcl2":false,"pcl3":false},{"id":2082,"root":1091,"depth":2,"k":1,"n_desc":1,"cl2":false,"cl3":false,"pcl2":false,"pcl3":false},{"id":2339,"root":1091,"depth":2,"k":1,"n_desc":1,"cl2":false,"cl3":false,"pcl2":false,"pcl3":false},{"id":5333,"root":1091,"depth":2,"k":1,"n_desc":2,"cl2":false,"cl3":false,"pcl2":false,"pcl3":false},{"id":5717,"root":1091,"depth":2,"k":1,"n_desc":1,"cl2":false,"cl3":false,"pcl2":false,"pcl3":false},{"id":6436,"root":1091,"depth":2,"k":1,"n_desc":1,"cl2":false,"cl3":false,"pcl2":false,"pcl3":false},{"id":2029,"root":1091,"depth":3,"k":1,"n_desc":1,"cl2":false,"cl3":false,"pcl2":false,"pcl3":false},{"id":4076,"root":1091,"depth":3,"k":2,"n_desc":3,"cl2":false,"cl3":false,"pcl2":true,"pcl3":false},{"id":4601,"root":1091,"depth":3,"k":1,"n_desc":1,"cl2":false,"cl3":false,"pcl2":false,"pcl3":false},{"id":6257,"root":1091,"depth":3,"k":2,"n_desc":2,"cl2":false,"cl3":false,"pcl2":true,"pcl3":false},{"id":6792,"root":1091,"depth":3,"k":1,"n_desc":1,"cl2":false,"cl3":false,"pcl2":false,"pcl3":false},{"id":1325,"root":1091,"depth":4,"k":1,"n_desc":1,"cl2":false,"cl3":false,"pcl2":false,"pcl3":false},{"id":3057,"root":1091,"depth":4,"k":1,"n_desc":1,"cl2":false,"cl3":false,"pcl2":false,"pcl3":false},{"id":3460,"root":1091,"depth":4,"k":1,"n_desc":1,"cl2":false,"cl3":false,"pcl2":false,"pcl3":false},{"id":3889,"root":1091,"depth":4,"k":0,"n_desc":2,"cl2":false,"cl3":false,"pcl2":false,"pcl3":false},{"id":4777,"root":1091,"depth":4,"k":2,"n_desc":2,"cl2":false,"cl3":false,"pcl2":true,"pcl3":false},{"id":5897,"root":1091,"depth":4,"k":1,"n_desc":1,"cl2":false,"cl3":false,"pcl2":false,"pcl3":false},{"id":5898,"root":1091,"depth":5,"k":1,"n_desc":1,"cl2":false,"cl3":false,"pcl2":false,"pcl3":false},{"id":6116,"root":1091,"depth":5,"k":0,"n_desc":3,"cl2":false,"cl3":false,"pcl2":false,"pcl3":false},{"id":11544,"root":1091,"depth":5,"k":1,"n_desc":1,"cl2":false,"cl3":false,"pcl2":false,"pcl3":false},{"id":12391,"root":1091,"depth":5,"k":0,"n_desc":1,"cl2":false,"cl3":false,"pcl2":false,"pcl3":false},{"id":12535,"root":1091,"depth":5,"k":1,"n_desc":1,"cl2":false,"cl3":false,"pcl2":false,"pcl3":false},{"id":13901,"root":1091,"depth":6,"k":0,"n_desc":2,"cl2":false,"cl3":false,"pcl2":false,"pcl3":false}],"cl":{"k2":{"id":1091,"lo":66,"hi":70,"method":"known","all_chains":true},"k3":{"id":1091,"lo":66,"hi":70,"method":"known","all_chains":true}},"edits":{"attributed":1,"ambiguous":6,"partial":1,"cross_root":0,"no_chain":14,"no_common_node":0,"by_node":{"13901":[{"seg":2,"type":"sub","status":"ambiguous"}],"3889":[{"seg":4,"type":"sub","status":"ambiguous"},{"seg":15,"type":"sub","status":"ambiguous"},{"seg":23,"type":"sub","status":"ambiguous"}],"6116":[{"seg":7,"type":"sub","status":"ambiguous"},{"seg":21,"type":"sub","status":"ambiguous"}],"12391":[{"seg":11,"type":"sub","status":"attributed"}]},"by_node_external":[]},"terms":{"1091-5914":"سمعت","5914-2082":"حدثنا","2082-2029":"حدثنا","2029-1325":"حدثنا","1325-6116":"حدثنا","1091-6347":"عن","6347-2339":"عن","2339-4076":"حدثني","4076-3460":"سمعت","3460-5898":"حدثنا","5898-6116":"حدثنا","6347-5333":"يحدث عن","5333-6257":"سمعت","6257-3057":"حدثنا","3057-6116":"حدثنا","6347-1851":"عن","1851-4076":"حدثنا","4076-4777":"حدثنا","4777-12391":"حدثنا","1091-3778":"عن","3778-6436":"عن","6436-6792":"عن","6792-3889":"حدثنا","5914-5717":"عن","5717-4601":"سألت","4601-3889":"حدثنا","6257-5897":"نا","5897-11544":"نا","11544-13901":"حدثنا","4777-12535":"نا","12535-13901":"حدثنا"},"shawahid":[398,1078,1091,2065,3320,3732,3807,3913]}