{"id":"tk-26604","complete":false,"all_chained":false,"books":{"b-6":[108427],"b-8":[150897],"b-15":[237508],"b-19":[195642]},"chains":[[4500,1227,4851,611,4210,5983,10935],[4500,1227,4851,611,4210,7223,12198],[4500,1227,4851,611,4210,3889]],"roots":[4500],"nodes":[{"id":4500,"root":4500,"depth":0,"k":1,"n_desc":3,"cl2":false,"cl3":false,"pcl2":false,"pcl3":false},{"id":1227,"root":4500,"depth":1,"k":1,"n_desc":3,"cl2":false,"cl3":false,"pcl2":false,"pcl3":false},{"id":4851,"root":4500,"depth":2,"k":1,"n_desc":3,"cl2":false,"cl3":false,"pcl2":false,"pcl3":false},{"id":611,"root":4500,"depth":3,"k":1,"n_desc":3,"cl2":false,"cl3":false,"pcl2":false,"pcl3":false},{"id":4210,"root":4500,"depth":4,"k":3,"n_desc":3,"cl2":true,"cl3":true,"pcl2":false,"pcl3":false},{"id":3889,"root":4500,"depth":5,"k":0,"n_desc":1,"cl2":false,"cl3":false,"pcl2":false,"pcl3":false},{"id":5983,"root":4500,"depth":5,"k":1,"n_desc":1,"cl2":false,"cl3":false,"pcl2":false,"pcl3":false},{"id":7223,"root":4500,"depth":5,"k":1,"n_desc":1,"cl2":false,"cl3":false,"pcl2":false,"pcl3":false},{"id":10935,"root":4500,"depth":6,"k":0,"n_desc":1,"cl2":false,"cl3":false,"pcl2":false,"pcl3":false},{"id":12198,"root":4500,"depth":6,"k":0,"n_desc":1,"cl2":false,"cl3":false,"pcl2":false,"pcl3":false}],"cl":{"k2":{"id":4210,"lo":211,"hi":214,"method":"known","all_chains":true},"k3":{"id":4210,"lo":211,"hi":214,"method":"known","all_chains":true}},"edits":{"attributed":3,"ambiguous":0,"partial":0,"cross_root":0,"no_chain":0,"no_common_node":0,"by_node":{"3889":[{"seg":1,"type":"sub","status":"attributed"}],"10935":[{"seg":3,"type":"sub","status":"attributed"},{"seg":5,"type":"sub","status":"attributed"}]},"by_node_external":[]},"terms":{"4500-1227":"عن","1227-4851":"عن","4851-611":"عن","611-4210":"عن","4210-5983":"حدثنا","5983-10935":"حدثنا","4210-7223":"نا","7223-12198":"حدثنا","4210-3889":"حدثنا"},"shawahid":[1091,2177,3026,3807,6480,6741]}