{"id":"tk-32978","complete":false,"all_chained":false,"books":{"b-15":[241280],"b-16":[216466,216468],"b-17":[121843,123742],"b-31":[295306,295308]},"chains":[[3783,3363,5239,3123,1689,5361,5483,1957,12319,11790,15071],[3783,3363,5239,3123,1689,5361,5483,1957,12319,11783,15071],[3783,3363,5239,3123,1689,5361,6952,10748,13428,11732,15071],[3783,3363,5239,3123,1689,5361,3447],[3783,3363,6011,1986,3834,9783,3447],[3783,3363,6011,1986,3834,3875,3889],[3783,3363,6011,1986,3834,6792,3889]],"roots":[3783],"nodes":[{"id":3783,"root":3783,"depth":0,"k":1,"n_desc":7,"cl2":false,"cl3":false,"pcl2":false,"pcl3":false},{"id":3363,"root":3783,"depth":1,"k":2,"n_desc":7,"cl2":true,"cl3":false,"pcl2":false,"pcl3":false},{"id":5239,"root":3783,"depth":2,"k":1,"n_desc":4,"cl2":false,"cl3":false,"pcl2":false,"pcl3":false},{"id":6011,"root":3783,"depth":2,"k":1,"n_desc":3,"cl2":false,"cl3":false,"pcl2":false,"pcl3":false},{"id":1986,"root":3783,"depth":3,"k":1,"n_desc":3,"cl2":false,"cl3":false,"pcl2":false,"pcl3":false},{"id":3123,"root":3783,"depth":3,"k":1,"n_desc":4,"cl2":false,"cl3":false,"pcl2":false,"pcl3":false},{"id":1689,"root":3783,"depth":4,"k":1,"n_desc":4,"cl2":false,"cl3":false,"pcl2":false,"pcl3":false},{"id":3834,"root":3783,"depth":4,"k":3,"n_desc":3,"cl2":false,"cl3":false,"pcl2":true,"pcl3":true},{"id":3875,"root":3783,"depth":5,"k":1,"n_desc":1,"cl2":false,"cl3":false,"pcl2":false,"pcl3":false},{"id":5361,"root":3783,"depth":5,"k":3,"n_desc":4,"cl2":false,"cl3":false,"pcl2":true,"pcl3":true},{"id":6792,"root":3783,"depth":5,"k":1,"n_desc":1,"cl2":false,"cl3":false,"pcl2":false,"pcl3":false},{"id":9783,"root":3783,"depth":5,"k":1,"n_desc":1,"cl2":false,"cl3":false,"pcl2":false,"pcl3":false},{"id":3447,"root":3783,"depth":6,"k":0,"n_desc":2,"cl2":false,"cl3":false,"pcl2":false,"pcl3":false},{"id":3889,"root":3783,"depth":6,"k":0,"n_desc":2,"cl2":false,"cl3":false,"pcl2":false,"pcl3":false},{"id":5483,"root":3783,"depth":6,"k":1,"n_desc":2,"cl2":false,"cl3":false,"pcl2":false,"pcl3":false},{"id":6952,"root":3783,"depth":6,"k":1,"n_desc":1,"cl2":false,"cl3":false,"pcl2":false,"pcl3":false},{"id":1957,"root":3783,"depth":7,"k":1,"n_desc":2,"cl2":false,"cl3":false,"pcl2":false,"pcl3":false},{"id":10748,"root":3783,"depth":7,"k":1,"n_desc":1,"cl2":false,"cl3":false,"pcl2":false,"pcl3":false},{"id":12319,"root":3783,"depth":8,"k":2,"n_desc":2,"cl2":false,"cl3":false,"pcl2":true,"pcl3":false},{"id":13428,"root":3783,"depth":8,"k":1,"n_desc":1,"cl2":false,"cl3":false,"pcl2":false,"pcl3":false},{"id":11732,"root":3783,"depth":9,"k":1,"n_desc":1,"cl2":false,"cl3":false,"pcl2":false,"pcl3":false},{"id":11783,"root":3783,"depth":9,"k":1,"n_desc":1,"cl2":false,"cl3":false,"pcl2":false,"pcl3":false},{"id":11790,"root":3783,"depth":9,"k":1,"n_desc":1,"cl2":false,"cl3":false,"pcl2":false,"pcl3":false},{"id":15071,"root":3783,"depth":10,"k":0,"n_desc":3,"cl2":false,"cl3":false,"pcl2":false,"pcl3":false}],"cl":{"k2":{"id":3363,"lo":63,"hi":83,"method":"known","all_chains":true}},"edits":{"attributed":0,"ambiguous":0,"partial":0,"cross_root":0,"no_chain":0,"no_common_node":0,"by_node":{},"by_node_external":[]},"terms":{"3783-3363":"أخبرني","3363-5239":"أخبرني","5239-3123":"أنه سمع","3123-1689":"أن","1689-5361":"عن","5361-5483":"أنبأ","5483-1957":"أنبأ","1957-12319":"أنبأ","12319-11790":"ثنا","11790-15071":"أخبرنا","12319-11783":"ثنا","11783-15071":"أخبرنا","5361-6952":"ثنا","6952-10748":"ثنا","10748-13428":"ثنا","13428-11732":"أنبأ","11732-15071":"أخبرنا","5361-3447":"عن","3363-6011":"أن","6011-1986":"عن","1986-3834":"عن","3834-9783":"عن","9783-3447":"عن","3834-3875":"عن","3875-3889":"حدثنا","3834-6792":"عن","6792-3889":"حدثنا"},"shawahid":[2,1389,1951,3320,3783,4677,4711]}