{"id":"tk-45953","complete":false,"all_chained":false,"books":{"b-4":[102719],"b-12":[310777],"b-13":[338530],"b-24":[57421]},"chains":[[3913,3961,2540,6933,698,31,10859],[3913,3961,2540,2472,3875,13035,16505,11502,13901]],"roots":[3913],"nodes":[{"id":3913,"root":3913,"depth":0,"k":1,"n_desc":2,"cl2":false,"cl3":false,"pcl2":false,"pcl3":false},{"id":3961,"root":3913,"depth":1,"k":1,"n_desc":2,"cl2":false,"cl3":false,"pcl2":false,"pcl3":false},{"id":2540,"root":3913,"depth":2,"k":2,"n_desc":2,"cl2":true,"cl3":false,"pcl2":false,"pcl3":false},{"id":2472,"root":3913,"depth":3,"k":1,"n_desc":1,"cl2":false,"cl3":false,"pcl2":false,"pcl3":false},{"id":6933,"root":3913,"depth":3,"k":1,"n_desc":1,"cl2":false,"cl3":false,"pcl2":false,"pcl3":false},{"id":698,"root":3913,"depth":4,"k":1,"n_desc":1,"cl2":false,"cl3":false,"pcl2":false,"pcl3":false},{"id":3875,"root":3913,"depth":4,"k":1,"n_desc":1,"cl2":false,"cl3":false,"pcl2":false,"pcl3":false},{"id":31,"root":3913,"depth":5,"k":1,"n_desc":1,"cl2":false,"cl3":false,"pcl2":false,"pcl3":false},{"id":13035,"root":3913,"depth":5,"k":1,"n_desc":1,"cl2":false,"cl3":false,"pcl2":false,"pcl3":false},{"id":10859,"root":3913,"depth":6,"k":0,"n_desc":1,"cl2":false,"cl3":false,"pcl2":false,"pcl3":false},{"id":16505,"root":3913,"depth":6,"k":1,"n_desc":1,"cl2":false,"cl3":false,"pcl2":false,"pcl3":false},{"id":11502,"root":3913,"depth":7,"k":1,"n_desc":1,"cl2":false,"cl3":false,"pcl2":false,"pcl3":false},{"id":13901,"root":3913,"depth":8,"k":0,"n_desc":1,"cl2":false,"cl3":false,"pcl2":false,"pcl3":false}],"cl":{"k2":{"id":2540,"lo":119,"hi":123,"method":"known","all_chains":true}},"edits":{"attributed":0,"ambiguous":0,"partial":2,"cross_root":0,"no_chain":0,"no_common_node":0,"by_node":{},"by_node_external":[]},"terms":{"3913-3961":"عن","3961-2540":"عن","2540-6933":"عن","6933-698":"عن","698-31":"حدثني","31-10859":"حدثنا","2540-2472":"عن","2472-3875":"عن","3875-13035":"ثنا","13035-16505":"ثنا","16505-11502":"نا","11502-13901":"حدثنا"},"shawahid":[1339,3913]}