{"id":"tk-26619","complete":true,"all_chained":true,"books":{"b-15":[241555,241559]},"chains":[[4500,4103,7072,100415,6792,3889],[22587,3071,4984,2588,3889]],"roots":[4500,22587],"nodes":[{"id":4500,"root":4500,"depth":0,"k":1,"n_desc":1,"cl2":false,"cl3":false,"pcl2":false,"pcl3":false},{"id":4103,"root":4500,"depth":1,"k":1,"n_desc":1,"cl2":false,"cl3":false,"pcl2":false,"pcl3":false},{"id":7072,"root":4500,"depth":2,"k":1,"n_desc":1,"cl2":false,"cl3":false,"pcl2":false,"pcl3":false},{"id":100415,"root":4500,"depth":3,"k":1,"n_desc":1,"cl2":false,"cl3":false,"pcl2":false,"pcl3":false},{"id":6792,"root":4500,"depth":4,"k":1,"n_desc":1,"cl2":false,"cl3":false,"pcl2":false,"pcl3":false},{"id":3889,"root":4500,"depth":5,"k":0,"n_desc":1,"cl2":false,"cl3":false,"pcl2":false,"pcl3":false},{"id":22587,"root":22587,"depth":0,"k":1,"n_desc":1,"cl2":false,"cl3":false,"pcl2":false,"pcl3":false},{"id":3071,"root":22587,"depth":1,"k":1,"n_desc":1,"cl2":false,"cl3":false,"pcl2":false,"pcl3":false},{"id":4984,"root":22587,"depth":2,"k":1,"n_desc":1,"cl2":false,"cl3":false,"pcl2":false,"pcl3":false},{"id":2588,"root":22587,"depth":3,"k":1,"n_desc":1,"cl2":false,"cl3":false,"pcl2":false,"pcl3":false},{"id":3889,"root":22587,"depth":4,"k":0,"n_desc":1,"cl2":false,"cl3":false,"pcl2":false,"pcl3":false}],"cl":{},"edits":{"attributed":0,"ambiguous":0,"partial":0,"cross_root":0,"no_chain":0,"no_common_node":0,"by_node":{},"by_node_external":[]},"terms":{"4500-4103":"في حكم العنعنة","4103-7072":"عن","7072-100415":"عن","100415-6792":"عن","6792-3889":"حدثنا","22587-3071":"أن","3071-4984":"عن","4984-2588":"عن","2588-3889":"حدثنا"},"shawahid":[2676,3234,3320,3655,3807,3913,5371,11234,22587]}