{"id":"tk-106070","complete":false,"all_chained":false,"books":{"b-1":[6101,6882],"b-4":[101503],"b-12":[315315],"b-13":[333249,337189],"b-17":[140427,140567],"b-22":[87720],"b-31":[291072,291080,291081]},"chains":[[3732,6330,3518,4035,6707,118,5495],[3732,6330,3518,4035,6707,118,5495],[3732,6330,3518,4035,3447,598,5495],[3732,6330,3518,4035,1321,1443,10859],[3732,6347,955,101229,11596,13901],[3732,6347,955,6700,13720,13901]],"roots":[3732],"nodes":[{"id":3732,"root":3732,"depth":0,"k":2,"n_desc":6,"cl2":true,"cl3":false,"pcl2":false,"pcl3":false},{"id":6330,"root":3732,"depth":1,"k":1,"n_desc":4,"cl2":false,"cl3":false,"pcl2":false,"pcl3":false},{"id":6347,"root":3732,"depth":1,"k":1,"n_desc":2,"cl2":false,"cl3":false,"pcl2":false,"pcl3":false},{"id":955,"root":3732,"depth":2,"k":2,"n_desc":2,"cl2":false,"cl3":false,"pcl2":true,"pcl3":false},{"id":3518,"root":3732,"depth":2,"k":1,"n_desc":4,"cl2":false,"cl3":false,"pcl2":false,"pcl3":false},{"id":4035,"root":3732,"depth":3,"k":3,"n_desc":4,"cl2":false,"cl3":false,"pcl2":true,"pcl3":true},{"id":6700,"root":3732,"depth":3,"k":1,"n_desc":1,"cl2":false,"cl3":false,"pcl2":false,"pcl3":false},{"id":101229,"root":3732,"depth":3,"k":1,"n_desc":1,"cl2":false,"cl3":false,"pcl2":false,"pcl3":false},{"id":1321,"root":3732,"depth":4,"k":1,"n_desc":1,"cl2":false,"cl3":false,"pcl2":false,"pcl3":false},{"id":3447,"root":3732,"depth":4,"k":1,"n_desc":1,"cl2":false,"cl3":false,"pcl2":false,"pcl3":false},{"id":6707,"root":3732,"depth":4,"k":1,"n_desc":2,"cl2":false,"cl3":false,"pcl2":false,"pcl3":false},{"id":11596,"root":3732,"depth":4,"k":1,"n_desc":1,"cl2":false,"cl3":false,"pcl2":false,"pcl3":false},{"id":13720,"root":3732,"depth":4,"k":1,"n_desc":1,"cl2":false,"cl3":false,"pcl2":false,"pcl3":false},{"id":118,"root":3732,"depth":5,"k":1,"n_desc":2,"cl2":false,"cl3":false,"pcl2":false,"pcl3":false},{"id":598,"root":3732,"depth":5,"k":1,"n_desc":1,"cl2":false,"cl3":false,"pcl2":false,"pcl3":false},{"id":1443,"root":3732,"depth":5,"k":1,"n_desc":1,"cl2":false,"cl3":false,"pcl2":false,"pcl3":false},{"id":13901,"root":3732,"depth":5,"k":0,"n_desc":2,"cl2":false,"cl3":false,"pcl2":false,"pcl3":false},{"id":5495,"root":3732,"depth":6,"k":0,"n_desc":3,"cl2":false,"cl3":false,"pcl2":false,"pcl3":false},{"id":10859,"root":3732,"depth":6,"k":0,"n_desc":1,"cl2":false,"cl3":false,"pcl2":false,"pcl3":false}],"cl":{"k2":{"id":3732,"lo":66,"hi":67,"method":"known","all_chains":true}},"edits":{"attributed":2,"ambiguous":0,"partial":2,"cross_root":0,"no_chain":4,"no_common_node":0,"by_node":{"13901":[{"seg":11,"type":"sub","status":"attributed"},{"seg":12,"type":"sub","status":"attributed"}]},"by_node_external":[]},"terms":{"3732-6330":"يحدث عن","6330-3518":"أنه سمع","3518-4035":"أخبرني","4035-6707":"أن","6707-118":"أخبرنا","118-5495":"حدثني","4035-3447":"أخبرنا","3447-598":"أخبرنا","598-5495":"حدثني","4035-1321":"عن","1321-1443":"حدثنا","1443-10859":"حدثنا","3732-6347":"عن","6347-955":"عن","955-101229":"نا","101229-11596":"نا","11596-13901":"حدثنا","955-6700":"نا","6700-13720":"نا","13720-13901":"حدثنا"},"shawahid":[895,2174,2177,3732,13926]}