{"id":"tk-54928","complete":false,"all_chained":false,"books":{"b-10":[41566],"b-12":[303485],"b-13":[332217],"b-24":[51142,56637,61230],"b-31":[293668]},"chains":[[3026,4781,4176,3218,5187,9712,13901],[3026,4781,4176,3218,5187,9712,13901]],"roots":[3026],"nodes":[{"id":3026,"root":3026,"depth":0,"k":1,"n_desc":2,"cl2":false,"cl3":false,"pcl2":false,"pcl3":false},{"id":4781,"root":3026,"depth":1,"k":1,"n_desc":2,"cl2":false,"cl3":false,"pcl2":false,"pcl3":false},{"id":4176,"root":3026,"depth":2,"k":1,"n_desc":2,"cl2":false,"cl3":false,"pcl2":false,"pcl3":false},{"id":3218,"root":3026,"depth":3,"k":1,"n_desc":2,"cl2":false,"cl3":false,"pcl2":false,"pcl3":false},{"id":5187,"root":3026,"depth":4,"k":1,"n_desc":2,"cl2":false,"cl3":false,"pcl2":false,"pcl3":false},{"id":9712,"root":3026,"depth":5,"k":1,"n_desc":2,"cl2":false,"cl3":false,"pcl2":false,"pcl3":false},{"id":13901,"root":3026,"depth":6,"k":0,"n_desc":2,"cl2":false,"cl3":false,"pcl2":false,"pcl3":false}],"cl":{},"edits":{"attributed":4,"ambiguous":0,"partial":0,"cross_root":0,"no_chain":6,"no_common_node":0,"by_node":{"13901":[{"seg":16,"type":"sub","status":"attributed"},{"seg":17,"type":"sub","status":"attributed"},{"seg":21,"type":"sub","status":"attributed"},{"seg":22,"type":"sub","status":"attributed"}]},"by_node_external":[]},"terms":{"3026-4781":"عن","4781-4176":"عن","4176-3218":"عن","3218-5187":"ثنا","5187-9712":"أنا","9712-13901":"حدثنا"},"shawahid":[3026]}