{"id":"tk-58183","complete":false,"all_chained":false,"books":{"b-12":[300146],"b-24":[59036]},"chains":[[2065,103555,7870,8177,609,11200,13901]],"roots":[2065],"nodes":[{"id":2065,"root":2065,"depth":0,"k":1,"n_desc":1,"cl2":false,"cl3":false,"pcl2":false,"pcl3":false},{"id":103555,"root":2065,"depth":1,"k":1,"n_desc":1,"cl2":false,"cl3":false,"pcl2":false,"pcl3":false},{"id":7870,"root":2065,"depth":2,"k":1,"n_desc":1,"cl2":false,"cl3":false,"pcl2":false,"pcl3":false},{"id":8177,"root":2065,"depth":3,"k":1,"n_desc":1,"cl2":false,"cl3":false,"pcl2":false,"pcl3":false},{"id":609,"root":2065,"depth":4,"k":1,"n_desc":1,"cl2":false,"cl3":false,"pcl2":false,"pcl3":false},{"id":11200,"root":2065,"depth":5,"k":1,"n_desc":1,"cl2":false,"cl3":false,"pcl2":false,"pcl3":false},{"id":13901,"root":2065,"depth":6,"k":0,"n_desc":1,"cl2":false,"cl3":false,"pcl2":false,"pcl3":false}],"cl":{},"edits":{"attributed":0,"ambiguous":0,"partial":0,"cross_root":0,"no_chain":0,"no_common_node":0,"by_node":{},"by_node_external":[]},"terms":{"2065-103555":"حدثني","103555-7870":"حدثني","7870-8177":"ثنا","8177-609":"حدثنا","609-11200":"ثنا","11200-13901":"حدثنا"},"shawahid":[]}