{"id":"tk-19430","complete":true,"all_chained":true,"books":{"b-16":[221795]},"chains":[[5183,6279,3447]],"roots":[5183],"nodes":[{"id":5183,"root":5183,"depth":0,"k":1,"n_desc":1,"cl2":false,"cl3":false,"pcl2":false,"pcl3":false},{"id":6279,"root":5183,"depth":1,"k":1,"n_desc":1,"cl2":false,"cl3":false,"pcl2":false,"pcl3":false},{"id":3447,"root":5183,"depth":2,"k":0,"n_desc":1,"cl2":false,"cl3":false,"pcl2":false,"pcl3":false}],"cl":{},"edits":{"attributed":0,"ambiguous":0,"partial":0,"cross_root":0,"no_chain":0,"no_common_node":0,"by_node":{},"by_node_external":[]},"terms":{"5183-6279":"أن","6279-3447":"عن"},"shawahid":[1389,4385]}