{"id":"tk-53799","complete":false,"all_chained":false,"books":{"b-3":[91695],"b-4":[97853],"b-8":[165993,165995],"b-12":[304081,304082],"b-15":[252231],"b-22":[78150],"b-28":[285674]},"chains":[[1211,6810,7183,6785,4875,2577],[1211,4798,3255,4055,1309,3398,6539,10859],[1211,6810,7183,6785,2672,11596,13901],[1211,4798,3255,4055,1309,3109,2379,13710,13901],[1211,4798,3255,4055,1309,4729,5459,14527,13901]],"roots":[1211],"nodes":[{"id":1211,"root":1211,"depth":0,"k":2,"n_desc":5,"cl2":true,"cl3":false,"pcl2":false,"pcl3":false},{"id":4798,"root":1211,"depth":1,"k":1,"n_desc":3,"cl2":false,"cl3":false,"pcl2":false,"pcl3":false},{"id":6810,"root":1211,"depth":1,"k":1,"n_desc":2,"cl2":false,"cl3":false,"pcl2":false,"pcl3":false},{"id":3255,"root":1211,"depth":2,"k":1,"n_desc":3,"cl2":false,"cl3":false,"pcl2":false,"pcl3":false},{"id":7183,"root":1211,"depth":2,"k":1,"n_desc":2,"cl2":false,"cl3":false,"pcl2":false,"pcl3":false},{"id":4055,"root":1211,"depth":3,"k":1,"n_desc":3,"cl2":false,"cl3":false,"pcl2":false,"pcl3":false},{"id":6785,"root":1211,"depth":3,"k":2,"n_desc":2,"cl2":false,"cl3":false,"pcl2":true,"pcl3":false},{"id":1309,"root":1211,"depth":4,"k":3,"n_desc":3,"cl2":false,"cl3":false,"pcl2":true,"pcl3":true},{"id":2672,"root":1211,"depth":4,"k":1,"n_desc":1,"cl2":false,"cl3":false,"pcl2":false,"pcl3":false},{"id":4875,"root":1211,"depth":4,"k":1,"n_desc":1,"cl2":false,"cl3":false,"pcl2":false,"pcl3":false},{"id":2577,"root":1211,"depth":5,"k":0,"n_desc":1,"cl2":false,"cl3":false,"pcl2":false,"pcl3":false},{"id":3109,"root":1211,"depth":5,"k":1,"n_desc":1,"cl2":false,"cl3":false,"pcl2":false,"pcl3":false},{"id":3398,"root":1211,"depth":5,"k":1,"n_desc":1,"cl2":false,"cl3":false,"pcl2":false,"pcl3":false},{"id":4729,"root":1211,"depth":5,"k":1,"n_desc":1,"cl2":false,"cl3":false,"pcl2":false,"pcl3":false},{"id":11596,"root":1211,"depth":5,"k":1,"n_desc":1,"cl2":false,"cl3":false,"pcl2":false,"pcl3":false},{"id":2379,"root":1211,"depth":6,"k":1,"n_desc":1,"cl2":false,"cl3":false,"pcl2":false,"pcl3":false},{"id":5459,"root":1211,"depth":6,"k":1,"n_desc":1,"cl2":false,"cl3":false,"pcl2":false,"pcl3":false},{"id":6539,"root":1211,"depth":6,"k":1,"n_desc":1,"cl2":false,"cl3":false,"pcl2":false,"pcl3":false},{"id":13901,"root":1211,"depth":6,"k":0,"n_desc":3,"cl2":false,"cl3":false,"pcl2":false,"pcl3":false},{"id":10859,"root":1211,"depth":7,"k":0,"n_desc":1,"cl2":false,"cl3":false,"pcl2":false,"pcl3":false},{"id":13710,"root":1211,"depth":7,"k":1,"n_desc":1,"cl2":false,"cl3":false,"pcl2":false,"pcl3":false},{"id":14527,"root":1211,"depth":7,"k":1,"n_desc":1,"cl2":false,"cl3":false,"pcl2":false,"pcl3":false}],"cl":{"k2":{"id":1211,"lo":17,"hi":1500,"method":"inferred","all_chains":true}},"edits":{"attributed":1,"ambiguous":3,"partial":1,"cross_root":0,"no_chain":9,"no_common_node":0,"by_node":{"13901":[{"seg":13,"type":"sub","status":"ambiguous"},{"seg":16,"type":"sub","status":"ambiguous"},{"seg":25,"type":"sub","status":"ambiguous"}],"10859":[{"seg":26,"type":"sub","status":"attributed"}]},"by_node_external":[]},"terms":{"1211-6810":"عن","6810-7183":"عن","7183-6785":"عن","6785-4875":"أنا","4875-2577":"حدثنا","1211-4798":"عن","4798-3255":"عن","3255-4055":"عن","4055-1309":"عن","1309-3398":"عن","3398-6539":"حدثنا","6539-10859":"حدثنا","6785-2672":"ثنا","2672-11596":"ثنا","11596-13901":"حدثنا","1309-3109":"عن","3109-2379":"ثنا","2379-13710":"ثنا","13710-13901":"حدثنا","1309-4729":"عن","4729-5459":"ثنا","5459-14527":"ثنا","14527-13901":"حدثنا"},"shawahid":[1211]}